<?xml version="1.0" encoding="UTF-8"?>
<books xmlns="http://www.example.org/book"
		xmlns:xsi="http://www.w3.org/2001/XMLSchema-instance"
		xsi:schemaLocation="http://www.example.org/book book.xsd">
	<book id="1001">
		<name>Thinking in Java</name>
		<author>Bruce Eckel</author>
		<price>86.4</price>
	</book>
	<book id="1002">
		<name>Head First 设计模式</name>
		<author>Freeman</author>
		<price>64.2</price>
	</book>
	<book id="1003">
		<name>深入理解Java虚拟机</name>
		<author>周志明 </author>
		<price>59.2</price>
	</book>
</books>