<?xml version="1.0" encoding="UTF-8"?>
<m:books xmlns:m="http://www.example.org/book"
		xmlns:xsi="http://www.w3.org/2001/XMLSchema-instance"
		xsi:schemaLocation="http://www.example.org/book book.xsd">
	<m:book id="1001">
		<m:name>Thinking in Java</m:name>
		<m:author>Bruce Eckel</m:author>
		<m:price>86.4</m:price>
	</m:book>
	<m:book id="1002">
		<m:name>Head First 设计模式</m:name>
		<m:author>Freeman</m:author>
		<m:price>64.2</m:price>
	</m:book>
	<m:book id="1003">
		<m:name>深入理解Java虚拟机</m:name>
		<m:author>周志明 </m:author>
		<m:price>59.2</m:price>
	</m:book>
</m:books>